Name;Synopsis;Classification;Release Date;Director;Cast;Upcoming Times;Screen Size;Cinema Rooms;Front Seats;Middle Seats;Rear Seats
The Shawshank Redemption;Two imprisoned men bond over a number of years, finding solace and eventual redemption through acts of common decency.;MA15+;16/02/1995;Frank Darabont;Tim Robbins, Morgan Freeman, Bob Gunton;10:45,14:00;Gold;1,2;2;1;2
The Godfather;An organized crime dynasty's aging patriarch transfers control of his clandestine empire to his reluctant son.;R18+;2/11/1972;Francis Ford Coppola;Marlon Brando, Al Pacino, James Cean;13:00;Gold;2;3;3;3
The Dark Knight;When the menace known as the Joker wreaks havoc and chaos on the people of Gotham, Batman must accept one of the greatest psychological and physical tests of his ability to fight injustice.;M;16/07/2008;Christopher Nolan;Christian Bale, Heath Ledger, Aaron Eckhart;9:00;Silver;1;5;5;5
12 Angry Men;The jury in a New York City murder trial is frustrated by a single member whose skeptical caution forces them to more carefully consider the evidence before jumping to a hasty verdict.;G;5/06/1958;Sidney Lumet;Henry Fonda, Lee J Cobb, Martin Balsam;16:00;Silver;3;5;5;5
Schindler's List;In German-occupied Poland during World War II, industrialist Oskar Schindler gradually becomes concerned for his Jewish workforce after witnessing their persecution by the Nazis.;M;10/02/1994;Steven Spielberg;Liam Neeson, Ralph Fiennes, Ben Kingsley;22:00;Silver;2;5;5;5
The Lord of the Rings: The Return of the King;Gandalf and Aragorn lead the World of Men against Sauron's army to draw his gaze from Frodo and Sam as they approach Mount Doom with the One Ring.;M;26/12/2003;Peter Jackson;Elijah Wood, Viggo Mortensen, Ian McKellen;11:30;Bronze;1;5;5;5
Pulp Fiction;The lives of two mob hitmen, a boxer, a gangster and his wife, and a pair of diner bandits intertwine in four tales of violence and redemption.;R18+;24/11/1994;Quentin Tarantino;John Travolta, Uma Thurman, Samuel L Jackson;14:10;Bronze;2;5;5;5
The Good, the Bad and the Ugly;A bounty hunting scam joins two men in an uneasy alliance against a third in a race to find a fortune in gold buried in a remote cemetery.;MA15+;31/07/1969;Sergio Leorne;Clint Eastwood, Eli Wallach, Lee Van Cleef;15:00,14:22,12:00,12:00;Bronze;3;5;5;5
